{
    "$schema": "../chain.schema.json",
    "chain_name": "ixo",
    "status": "live",
    "network_type": "mainnet",
    "pretty_name": "IXO",
    "chain_id": "impacthub-3",
    "bech32_prefix": "ixo",
    "slip44": 118,
    "apis": {
        "rpc": [
            {
                "address": "https://rpc-impacthub.keplr.app",
                "provider": "chainapsis"
            },
            {
                "address": "https://proxies.sifchain.finance/api/impacthub-3/rpc",
                "provider": "sifchain"
            },
            {
                "address": "http://18.220.101.192:26657/",
                "provider": "regen"
            }
        ],
        "rest": [
            {
                "address": "https://lcd-impacthub.keplr.app",
                "provider": "chainapsis"
            },
            {
                "address": "https://proxies.sifchain.finance/api/impacthub-3/rest",
                "provider": "sifchain"
            },
            {
                "address": "http://18.220.101.192:1317/",
                "provider": "regen"
            }
        ]
    }
}