{
    "$schema": "../chain.schema.json",
    "chain_name": "cryptoorg",
    "status": "live",
    "network_type": "mainnet",
    "pretty_name": "Crypto.org",
    "chain_id": "crypto-org-chain-mainnet-1",
    "bech32_prefix": "cro",
    "slip44": 394,
    "apis": {
        "rpc": [
            {
                "address": "https://rpc-crypto-org.keplr.app/",
                "provider": "chainapsis"
            }
        ],
        "rest": [
            {
                "address": "https://lcd-crypto-org.keplr.app/",
                "provider": "chainapsis"
            }
        ]
    }
}
