{
    "$schema": "../chain.schema.json",
    "chain_name": "sentinel",
    "status": "live",
    "network_type": "mainnet",
    "pretty_name": "Sentinel",
    "chain_id": "sentinelhub-2",
    "bech32_prefix": "sent",
    "slip44": 750,
    "apis": {
        "rpc": [
            {
                "address": "https://rpc-sentinel.keplr.app",
                "provider": "chainapsis"
            }
        ],
        "rest": [
            {
                "address": "https://lcd-sentinel.keplr.app",
                "provider": "chainapsis"
            }
        ]
    }
}