{
    "$schema": "../chain.schema.json",
    "chain_name": "juno",
    "status": "live",
    "network_type": "mainnet",
    "pretty_name": "Juno",
    "chain_id": "juno-1",
    "bech32_prefix": "juno",
    "slip44": 118,
    "apis": {
        "rpc": [
            {
                "address": "https://rpc-juno.itastakers.com",
                "provider": "itastakers"
            }
        ],
        "rest": [
            {
                "address": "https://lcd-juno.itastakers.com",
                "provider": "itastakers"
            }
        ]
    }
}
