{
    "$schema": "../chain.schema.json",
    "chain_name": "starname",
    "status": "live",
    "network_type": "mainnet",
    "pretty_name": "Starname",
    "chain_id": "iov-mainnet-ibc",
    "bech32_prefix": "star",
    "slip44": 234,
    "apis": {
        "rpc": [
            {
                "address": "https://rpc-iov.keplr.app",
                "provider": "chainapsis"
            }
        ],
        "rest": [
            {
                "address": "https://lcd-iov.keplr.app",
                "provider": "chainapsis"
            }
        ]
    }
}