{
    "$schema": "../chain.schema.json",
    "chain_name": "isisnet",
    "status": "live",
    "network_type": "mainnet",
    "pretty_name": "Irisnet",
    "chain_id": "irishub-1",
    "bech32_prefix": "iris",
    "apis": {
        "rpc": [
            {
                "address": "https://rpc-iris.keplr.app",
                "provider": "chainapsis"
            }
        ],
        "rest": [
            {
                "address": "https://lcd-iris.keplr.app",
                "provider": "chainapsis"
            }
        ]
    }
}
