{
    "$schema": "../chain.schema.json",
    "chain_name": "terra",
    "status": "live",
    "network_type": "mainnet",
    "pretty_name": "Terra",
    "chain_id": "columbus-5",
    "bech32_prefix": "terra",
    "apis": {
        "rpc": [
            {
                "address": "http://64.227.72.101:26657",
                "provider": "cryptocrew"
            }
        ],
        "rest": [
            {
                "address": "http://64.227.72.101:1317",
                "provider": "cryptocrew"
            }
        ]
    }
}
